,tweet,reply1,reply2,reply3,reply4,reply5,reply6,reply7,reply8,reply9,reply10,reply11,reply12,reply13,reply14,reply15,reply16,reply17,reply18,reply19,reply20,reply21,reply22,reply23,reply24,reply25,reply26,reply27,reply28,reply29,reply30,reply31,reply32,reply33,reply34,reply35,reply36,reply37,reply38,reply39,reply40,reply41,reply42,reply43,reply44,reply45,reply46,reply47,reply48,reply49,reply50,reply51,reply52,reply53,reply54,reply55,reply56,reply57
27,Тихановская созвонилась с гендиректором Yara International и призвала к давлению на Беларуськалий.… https://t.co/gy9zprs1Jz,@tutby молодец! правильная тактика!!,"@tutby 👑 Ms. President Elect 👍
Keep pressure on Yara International
@yara
https://t.co/uxLQPfASeW",@tutby Дура бл.,"@tutby Моя жена вчера звонила в оон, мус и еспч для блокировки Беларуськалия
Обещали разобраться","@tutby Она хоть понимает ,что скоро ее фамилия станет нарицательной ,как мазепа или иуда.",@tutby Тупенькая бабёнка поговорила с автоответчиком.😂,"@tutby Одно не понятно. Почему в Беларуси до сих пор нет подразделений, которые достают таких людей в любой точке м… https://t.co/wyeMkQhqtB",@tutby Цікава паглядзець на вынікі,"@tutby ТУТ одни дегенераты в комментариях.что будет с ними при нормальной власти?в концлагерь—нельзя,не гуманно.переживаю.",@tutby Ботаферма гіцае не на жарт тут. Гараць сракі - аж палаюць.,"@tutby Чучело с кем то может созвониться🤣?  Тутки, вы как обычно, родили очередной высер.","@tutby А если надавят и белкалий станет потеряв контракт, то она будет платить рабочим и скидывать деньги в бюджет?… https://t.co/V5zm1mOnh2",@tutby Ведьму пора на нары определять!!!,@tutby Коллектив беларуськалия будет ей благодарен по гроб(её),"@tutby Шо, без давления на Калий швабода не вытанцовывается?",@tutby С ее английским и отрицательным IQ я думаю что директор нихера не понял. На крайняк пиццу заказал.,@tutby А старуха Шапокляк продолжает «заботиться» о белорусах!,@tutby Что она может сказать? Марионетка в руках запада. Горемычная.,"@tutby Подумайте, 
почему Тихановская не обратилась в правительство Литвы с требованием запретить транзит?

Ведь эт… https://t.co/eElLUTDF2b",@tutby Трубку-то подняли или как обычно?..,@tutby Ну дура дурой.,"@tutby Я тоже позвонил и призвал к дальнейшей работе. Вот и посмотрите что на него больше подействует, бешенство… https://t.co/FiwhQ1z4kg","@tutby Молодец, Светлана!",@tutby Беглая каторжница призвала...,"@tutby не сработает. по той причине, что европа прекрасно видит что будет при отказе. а будет как с лднр, когда уго… https://t.co/aDt3hvlSbC",@tutby Почему она не требует запрета транзита и перевалки грузов через Литву?,@tutby Не поможет! Полагаю судьба уже решена.,"@tutby А он такой: ""дадада, будем рубить сук, на котором сидим""",@tutby чем больше такой движухи тем лучше,,,,,,,,,,,,,,,,,,,,,,,,,,,,
28,Студенты Белорусского государственного технологического университета развесили листовки на стенах вуза — как напоми… https://t.co/Y8LnDiOzUp,@tutby @lYtVqSo63sJIUbc 👍,@tutby Гебремариам - эфиопка?,@tutby @directklad ✊⬜️🟥⬜️,@tutby Да не кто не хочет учится на чужих ошибках.,@tutby Стращают значит. Работают на режим,@tutby Училась здесь😊 Горжусь!,,,,,,,,,,,,,,,,,,,,,,,,,,,,,,,,,,,,,,,,,,,,,,,,,,,
29,"Юноша, совращенный 25-летней учительницей, требует компенсацию в суде.

Больше 700 тысяч долларов за секс.… https://t.co/UVQJboG5rg",@tutby Раньше в 13 лет в брак вступали.,@tutby Ну и лох. Я бы дальше тусовался,"@tutby Вот,вот.",@tutby Охуел совсем,@tutby Фамилия не Шурыгин случайно?,@tutby Куда катится этот мир?,@tutby Дорогие услуги у юноши. Далеко пойдет,"@tutby Где были мои совратительницы, когда я в школе учился?","@tutby Ну конечно, пока он ее жарил и она ему сосала все было офигенно. Потом под давлением родителей и органов юве… https://t.co/19hPVqokwI","@tutby Не юноша, а ребёнок, не за секс, а за преступление. Хорошо, что тутки не СМИ.","@tutby Ну это надо быть больной на голову, чтобы додуматься заняться сексом с 13 летним собственным учеником 🤦‍♂️","@tutby Кликбейт. Это не он потребовал, а его родители, пацан тр*хал бы и дальше.",@tutby Niccce!,@tutby Вот шлюха!,@tutby Раздел LadyTutBy пробивает все новное дно... ну что за кликбейт уровня деревенских журналов из кисока...,@tutby Какой продвинутый юноша!😸,@tutby https://t.co/EwbvYFV0VM Южный парк на все случаи жизни,@tutby Козел,"@tutby Я очень уважаю вашу работу. Но подумайте, пожалуйста, о том как выбираете своих фотографии. Это просто ужас и кликбейт.",@tutby Бляяааа!!! кому свой секс за 700 штук продать 😯?!!! Училка конечно отожгла🔥😃,@tutby Родители подсуетились,"@tutby Дорого он оценил свои ""умения""... 🤣🤣🤣",@tutby Красиво делает. И потрахался и деньги получил,"@tutby хорошо что у нас в Беларуси за такое еще бы доплатили, а не в суд подавали :))",@tutby вот ведь сука какая,@tutby Ля крыса,,,,,,,,,,,,,,,,,,,,,,,,,,,,,,,
30,"Опыт мамы, чей сын отказался ходить в детский сад.

«Нам не удавалось даже одеть ребенка». 

https://t.co/DRz6kwxR8u https://t.co/QUY9XBgFgN",@tutby антисистемньій ребёнок.,@tutby у меня была такая же футболка) езлёная,,,,,,,,,,,,,,,,,,,,,,,,,,,,,,,,,,,,,,,,,,,,,,,,,,,,,,,
31,"Посмотрите на суперзащищенный Samsung Galaxy XCover 5, который не боится падений, перепадов температур, воды и пыли… https://t.co/WpbGKSJuZS",@tutby Говно,"@tutby tft экран (((
на солнце не видно будет нормально
понятно что с амолед будет дороже но какой смысл в таком те… https://t.co/NJZ2OSziMS",,,,,,,,,,,,,,,,,,,,,,,,,,,,,,,,,,,,,,,,,,,,,,,,,,,,,,,
32,"Президент Бразилии призвал «не ныть» на фоне рекордной смертности от коронавируса.

https://t.co/7rIGsEVv5X https://t.co/TuP3GRZigR",@tutby Психоз же ну,"@tutby Это он прямо здорово помог, да",@tutby Ещё один плешивый ублюдок! «»,,,,,,,,,,,,,,,,,,,,,,,,,,,,,,,,,,,,,,,,,,,,,,,,,,,,,,
33,"Синоптики рассказали о погоде в выходные и 8 марта: мокрый снег, метели, гололедица и ночные морозы.… https://t.co/Cay5boBebB",@tutby Ой всё!,"@tutby Какая прелесть. Весна пришла.🥰
#сарказм разумеется",@tutby снег падал на стекло чистым и становился грязным,,,,,,,,,,,,,,,,,,,,,,,,,,,,,,,,,,,,,,,,,,,,,,,,,,,,,,
34,"Бизнес-союз резко ответил на предложение МНС побороться с зарплатами в конвертах.

Не с того начали.… https://t.co/lDwmo88B5s","@tutby Латушка ж расказаў пра зарплату ў канвертах, цікава, ці аштрафуюць адміністрацыю прэзідэнта, альбо можа нава… https://t.co/Zgrn0OHP1L","@tutby Согласен, для вас это актуально. Более чем😁",,,,,,,,,,,,,,,,,,,,,,,,,,,,,,,,,,,,,,,,,,,,,,,,,,,,,,,
35,"Жителя Новополоцка, который осенью отстоял БЧБ-флаг на своем балконе, недавно все же осудили.… https://t.co/dEO2TBRRr5","@tutby 💐💐💐💐💐

❤️❤️📢❤️❤️

⬜️⬜️⬜️⬜️⬜️
🟥🟥🟥🟥🟥🩸 😓 😢
⬜️⬜️⬜️⬜️⬜️

❤️❤️🥊❤️❤️

💐💐💐💐💐",,,,,,,,,,,,,,,,,,,,,,,,,,,,,,,,,,,,,,,,,,,,,,,,,,,,,,,,
36,"Где искать «длинные» рублевые вклады под 19−20 процентов годовых?

https://t.co/OhJF0N2fdk https://t.co/qC9tKemJAN","@tutby На дне белорусского чуда,  глубже Бикини Ботон",@tutby а смысл?,@tutby Скажите пожалуйста где искать деньги,,,,,,,,,,,,,,,,,,,,,,,,,,,,,,,,,,,,,,,,,,,,,,,,,,,,,,
37,"15-летнего подростка, пропавшего во вторник в Минском районе, нашли.

https://t.co/exyGdivtk3 https://t.co/2WDF5aAMAP","@tutby А написать, что нашли живым, жопа отвалится?",,,,,,,,,,,,,,,,,,,,,,,,,,,,,,,,,,,,,,,,,,,,,,,,,,,,,,,,
38,"Лукашенко освободил от должности своего помощника — инспектора по Минской области.

https://t.co/6YcC8P7maX https://t.co/Ye69VLIR2M",@tutby Плохо помогал,"@tutby ОСВОБОДИЛ от должности - это что, получается, он его до этого в плену держал?",@tutby На хуй идут,@tutby https://t.co/asph6qmaXc,,,,,,,,,,,,,,,,,,,,,,,,,,,,,,,,,,,,,,,,,,,,,,,,,,,,,
39,"Посольство США поддержало церковь «Новая жизнь», которую лишили здания.

https://t.co/Jv8Lijp1I4 https://t.co/6TeC56v07s",@tutby Недавно они Навального поддержали),"@tutby Ну как же без американцев? Все их беспокоит и всех им жалко. Вот сердобольный народ. Застрелили преступника,… https://t.co/scEFpbkMp7","@tutby 😆 Ну теперь с такой да поддержкой, ох как жизнь станет лучше)",@tutby Палят всех агентов https://t.co/dijnh5ihKX,"@tutby Не церковь, а помойная секта по привлечению предателей Беларуси паскудить стране",@tutby Запад с нами!,@tutby Религия — опиум для народа.,@tutby Сектантов вы хотели сказать?,"@tutby Не церковь,а секта влияния.....",@tutby Американский дипломат выразил обеспокоенность....,,,,,,,,,,,,,,,,,,,,,,,,,,,,,,,,,,,,,,,,,,,,,,,
40,"Так у зала суда близкие встречали волонтера штаба Бабарико Антона Беленского.

Поддержать Антона пришел и отец Мари… https://t.co/upbvbpoIVd","@tutby ""Приговор вступит в ЗАКОННУЮ силу..."" аж коробит от такой формулировки.",,,,,,,,,,,,,,,,,,,,,,,,,,,,,,,,,,,,,,,,,,,,,,,,,,,,,,,,
41,"Читатели пишут, что такой «плюшевый десант» появился на горе Дзержинской — самой высокой точке Беларуси (345 метров… https://t.co/61dTHn12Fg",@tutby Фееричные д...бы!,"@tutby Хорош уже позорить страну. 
Люди не в теме, посмотрев такие ""новости"" будут думать, что в Беларуси повально… https://t.co/gSNeuwzmNR","@tutby мяркую, складнік галоваў мядзведзікаў і неверагодных, якія іх туды прынеслі, досыць ідэнтычны.
еднасць. 
едн… https://t.co/8aJjT0lZwh","@tutby Боты опять сели на бутылку и кончили)))) Приятно!
Раз выродков, ублюдков, мразей, гопоту, мусорню прикормлен… https://t.co/egt3EESWH6","@tutby бля,вот же ебанутые...","@tutby Мне кажется, или сзади на фото убегающий в сторону Польши макей в одних труханах?",@tutby занятая нечем ),@tutby @Parbusse @looter_99 плюшевый десант уже не тот!(,"@tutby И на каждой плюшке бчб-тряпка коллаборантов. Феерично, йопта!",@tutby Ну да. Цветочками и мишками. Ага.,@tutby Весной рэжыму хана... Это факт ☝️,@tutby Тутбаевцы постарались!,"@tutby Да это же НАТОвское смертоносное подразделение 'зундер-плюхен-командос', мало им гусеницами лязгать под наши… https://t.co/hnn0Ogqhq9","@tutby Боты, к бою","@tutby Бчбесы гадят везде, где только могут... https://t.co/m51JqkKEDN",,,,,,,,,,,,,,,,,,,,,,,,,,,,,,,,,,,,,,,,,,
42,"Минчанки хотели обратиться к депутату, а попали на Окрестина.

«Дочка видела, как нас забирали. Всю ночь плакала».… https://t.co/JPdV0TqKDa","@tutby Читайте не TUTBY арестовали за то что бедная мама пекла пироги для бабушки.

Сочетание наличия детей, пирого… https://t.co/gRjQ6F7jwM",,,,,,,,,,,,,,,,,,,,,,,,,,,,,,,,,,,,,,,,,,,,,,,,,,,,,,,,
43,"Волонтеру штаба Бабарико Антону Беленскому дали 1,5 года «химии».

https://t.co/dYx0QfrINF https://t.co/09yCSiCo8A","@tutby Читайте не TUTBY арестовали за то что бедная мама пекла пироги для бабушки.

Сочетание наличия детей, пирого… https://t.co/gRjQ6F7jwM",,,,,,,,,,,,,,,,,,,,,,,,,,,,,,,,,,,,,,,,,,,,,,,,,,,,,,,,
44,"Что происходило в феврале на валютном рынке?

Предприятия закупались валютой, население ушло в безнал.… https://t.co/iXfPqH5vci",@tutby А сбережения населения - ушли в (к)анал(изацию).,"@tutby ""По итогам прошлого года безналичная покупка валюты населением превысила продажу на 1,822 млрд долларов."" ай… https://t.co/86JN2tgIqs",,,,,,,,,,,,,,,,,,,,,,,,,,,,,,,,,,,,,,,,,,,,,,,,,,,,,,,
45,"Генпрокуратура направила в Литву запрос о выдаче Тихановской, а в суд — дело «о тайной вечере».… https://t.co/0oPYuAwxeH","@tutby Яматка в бешенстве, говорят устроила истерику","@tutby -Хто ""дапамог"" Ціханоўскай ""схавацца"" ў Літве? 
-Аграном! Ён сам пра гэта распавядаў не аднойчы! Яшчэ і грош… https://t.co/atcz9s6d7t",@tutby А как она оказалась в Литве? Кто ей помог там оказаться? Почему их не интересует этот вопрос?,"@tutby Так Литва ж заранее показала дулю, не?",@tutby А инструкцию к губозакаточной машинке они уже прочитали?,"@tutby Какая вечера в 10 утра?
Встреча группы по захвату зданий вы сравниваете с последней вечерей Христа?

То что… https://t.co/UTN2E93tSn",,,,,,,,,,,,,,,,,,,,,,,,,,,,,,,,,,,,,,,,,,,,,,,,,,,
46,"Сможете назвать всех вратарей «Динамо» в КХЛ? 

Даем шесть минут!

https://t.co/Y2xvgePnSo https://t.co/ENzsQJoxed",@tutby пусть идут нахуй,"@tutby Наврятли их кто-то знает ! Хоккей не так уж и популярен в Беларуси, в основном это просто развлечение Лукаша… https://t.co/WhRiKfbZx4",,,,,,,,,,,,,,,,,,,,,,,,,,,,,,,,,,,,,,,,,,,,,,,,,,,,,,,
47,"На проспекте Независимости в Минске ДТП: столкнулись не меньше трех авто.

https://t.co/xgUtnh80bF https://t.co/WYZ9nVXWsh",@tutby пусть идут нахуй,"@tutby Наврятли их кто-то знает ! Хоккей не так уж и популярен в Беларуси, в основном это просто развлечение Лукаша… https://t.co/WhRiKfbZx4",,,,,,,,,,,,,,,,,,,,,,,,,,,,,,,,,,,,,,,,,,,,,,,,,,,,,,,
48,"Суд огласил приговор водителю, который прокатил на капоте гаишника: 10 лет колонии.

https://t.co/of1kZ1NT6J https://t.co/8iyPoDdZ0g","@tutby Слушайте, а зачем вы Тихановской на аватарке усы пририсовали? Это просто хулиганство какое-то.",@tutby Надо пойти еще пофоткаться с ментами 🤦,"@tutby Заграницей после такой х**ни многие политики и чиновники остались бы без работы, а менты бы сидели. У нас же… https://t.co/NawmYfZahm",@tutby Поддерживаю! Можно было и больше дать.,"@tutby Давайте дальше сидеть на жопах и говорить, как всё плохо, пока чел по этапу пойдёт. Или хоровод замутим?","@tutby Что ещё нужно сделать власти, чтобы...
Хотя....",@tutby Мрази,"@tutby Водитель полностью осознавал общественную опасность своих противоправных действий, направленных на лишение ж… https://t.co/0uhNzOyHtd",@tutby Судя по комментариям где-то прорвало канализацию,"@tutby Да, щедрые ребятишки трудятся в наших судах. Они, видимо, рассчитывают, что нынешний режим будет вечный. Так… https://t.co/3GXv85drWD","@tutby Тутки вонючки, очень надеюсь, что вас будут так катать. А преступнику заслуженное наказание. Радуйтесь таком… https://t.co/e8eLVc4PT3","@tutby Вот же мрази! Если народ не соберётся и не прогонит Лукаша, то тысячи невинных людей будут сидеть долгие год… https://t.co/6noUTNfBxN","@tutby Млять, не сбил, а прокатил на капоте!!! Вы совсем там 0)(₽енели?","@tutby Человек, спасавший свою жизнь от извергов в масках, получает 10 лет. В этой стране самоборона - это особо тя… https://t.co/0BQbN6zaVl","@tutby Захотите покататься, проститутки, пишите в ЛС. Привезу баян. Под баянчик!",@tutby нормально так.,"@tutby Просто ах#енно. Ему надо было оставаться  там и ждать, пока ему кости перехерачат? Человек защищал свою жизнь от бандитов","@tutby коллектив тутбай уже давным-давно должен был шить рукавицы, по статьям, связанным с угрозе суверенитету госу… https://t.co/s6UbqDzWec",@tutby ПроститеТУТки что бы вас с Золотовой так катали на копоте до конца дней,@tutby На требование остановится совершил  умышленый наезд на сотрудников милиции обвинён по  ст. 14 (Покушение на… https://t.co/X1svO7ubwH,@tutby Норм,"@tutby Не суд, а судилище😡",@tutby Отлично! Хороший срок!,,,,,,,,,,,,,,,,,,,,,,,,,,,,,,,,,,
49,"Золотовалютные резервы в феврале продолжили снижение: долги и спрос на валюту.

https://t.co/xyxQOMiZ7S https://t.co/zCnwxnoMqi","@tutby - Шеф, у нас дыра в резервах!
- Ну хоть что-то у нас есть в резервах.",,,,,,,,,,,,,,,,,,,,,,,,,,,,,,,,,,,,,,,,,,,,,,,,,,,,,,,,
