,tweet,reply1,reply2,reply3,reply4,reply5,reply6,reply7,reply8,reply9,reply10,reply11,reply12,reply13,reply14,reply15,reply16,reply17,reply18,reply19,reply20,reply21,reply22,reply23,reply24,reply25,reply26,reply27,reply28,reply29,reply30,reply31,reply32,reply33,reply34,reply35,reply36,reply37,reply38,reply39,reply40,reply41,reply42,reply43,reply44,reply45,reply46,reply47,reply48,reply49,reply50,reply51,reply52,reply53,reply54,reply55,reply56,reply57
76,"Кошка задержала отправление скоростного поезда на два с половиной часа.

https://t.co/kCVuNTEcZk https://t.co/bVja9FmJVI",@tutby На Западе у кошки больше прав и свобод чем у человека в Беларуси. https://t.co/VjFF6P5c1R,@tutby Не следят в Англии за трендами https://t.co/5jwosnlyNf,@tutby Лайк таким кошкам,"@tutby Кіт, ты маму мав?",,,,,,,,,,,,,,,,,,,,,,,,,,,,,,,,,,,,,,,,,,,,,,,,,,,,,
77,"В докладе спецслужб Литвы о возможных угрозах в 2021 году — много о Беларуси.

Кратко рассказываем, чем озабочены л… https://t.co/X0OKJsiYsP","@tutby Когда жена застала с любовницей, он заявил что виноват не он, а Лукашенко

🤣😂😂 https://t.co/PbM3P0vBbi","@tutby ""«любовные ловушки» инцидент с попыткой спецслужб нашей страны склонить к сотрудничеству литовца, который до… https://t.co/AQqyfILP8P","@tutby Спецслужбы Литвы озабочены, что КГБ Беларуси вербует озабоченных литовцев с помощью секса?",@tutby Спецслужбы Литвы. Смешно уже от самого названия😁,"@tutby Литва...спецслужбы...озабочены...
Уже даже само сочетание этих слов бред какой-то напоминает.",@tutby Фашистское государство в качестве соседа - по-любому угроза,@tutby Так лабусы давно пиндоские инструкции передают - передасты короч ((,"@tutby BelNPP
Russian troops
KGB
Novichok 🩲",,,,,,,,,,,,,,,,,,,,,,,,,,,,,,,,,,,,,,,,,,,,,,,,,
78,"Можно ли уберечь ребенка от рака и как во время заметить тревожные симптомы?

Поговорили об этом с детским онколого… https://t.co/C99wATv2La","@tutby Когда жена застала с любовницей, он заявил что виноват не он, а Лукашенко

🤣😂😂 https://t.co/PbM3P0vBbi","@tutby ""«любовные ловушки» инцидент с попыткой спецслужб нашей страны склонить к сотрудничеству литовца, который до… https://t.co/AQqyfILP8P","@tutby Спецслужбы Литвы озабочены, что КГБ Беларуси вербует озабоченных литовцев с помощью секса?",@tutby Спецслужбы Литвы. Смешно уже от самого названия😁,"@tutby Литва...спецслужбы...озабочены...
Уже даже само сочетание этих слов бред какой-то напоминает.",@tutby Фашистское государство в качестве соседа - по-любому угроза,@tutby Так лабусы давно пиндоские инструкции передают - передасты короч ((,"@tutby BelNPP
Russian troops
KGB
Novichok 🩲",,,,,,,,,,,,,,,,,,,,,,,,,,,,,,,,,,,,,,,,,,,,,,,,,
79,"Что такое «синдром отличника» и почему таким людям очень тяжело жить?

https://t.co/2fuxCVCFFS https://t.co/qEt7IKMIZs",@tutby нам хорошистам не понять,,,,,,,,,,,,,,,,,,,,,,,,,,,,,,,,,,,,,,,,,,,,,,,,,,,,,,,,
80,"Опубликовали итоги республиканского опроса по COVID-19, который проводили в ноябре–декабре 2020 года.

Большинство… https://t.co/EVTo6lck6Q","@tutby Хто-хто? НАН Беларусі? Сацыялагічнае даследванне?
Іншых казак у вас няма там?",,,,,,,,,,,,,,,,,,,,,,,,,,,,,,,,,,,,,,,,,,,,,,,,,,,,,,,,
81,"Лукашенко повысил в звании госсекретаря Совета безопасности.

https://t.co/MuUuHg8oTQ https://t.co/2As3vKFRFN",@tutby Ура товарищи!!! https://t.co/ITS0iR15CZ,@tutby почему вся эта чинушня и силушня так похожа на мертвечину? вопрос риторический,@tutby Тяперича - генерал-фельдмаршал. Почти как Паулюс.,"@tutby Когда генеральские погоны закончатся у сипатого, начнёт награждать жёлтыми штанами стабильнасти...","@tutby Вешает медальки своим собачкам, а те и радуются. Паноптикум, блять https://t.co/TXMcc7BWA8","@tutby Навіны, апошнім часам, амаль усе пра якіх-та невядомых салдат. Пра якіясь медалі, чыны, пагоны.
Хто усе гэты… https://t.co/e6oHNzUBdT","@tutby Надо было медаль дать , а то как-то несерьёзно.",@tutby как то он побледнел. от гордости наверное...,"@tutby На столбе будет висеть, уёбок👎",@tutby На хуй идут,"@tutby Rank of Secretary
Does he make the coffee?",@tutby https://t.co/9IgozIk4TM,@tutby маршал?,,,,,,,,,,,,,,,,,,,,,,,,,,,,,,,,,,,,,,,,,,,,
82,"В Налоговый кодекс ввели изменения, которые касаются зарплат «в конвертах».

Если обнаружат такие выплаты, то с раб… https://t.co/IgqcBoLbZI",@tutby .. они должны стучать?,,,,,,,,,,,,,,,,,,,,,,,,,,,,,,,,,,,,,,,,,,,,,,,,,,,,,,,,
83,"Какие реликвии потерял мир в новом тысячелетии?

https://t.co/HgnR3Oz8fX https://t.co/7Xu3AnYXaY",@tutby И все они потеряны за время оккупации США.,,,,,,,,,,,,,,,,,,,,,,,,,,,,,,,,,,,,,,,,,,,,,,,,,,,,,,,,
84,"Какие фильмы должны выйти в этом году? 

Вот пять самых ожидаемых.

https://t.co/mTadfFB3sO https://t.co/PcGakmbymO",@tutby И все они потеряны за время оккупации США.,,,,,,,,,,,,,,,,,,,,,,,,,,,,,,,,,,,,,,,,,,,,,,,,,,,,,,,,
85,"Год с коронавирусом. Куда белорусы сейчас могут слетать за границу и что для этого нужно?

https://t.co/5Lp7hSVczt https://t.co/2LYu7ifoxc",@tutby И все они потеряны за время оккупации США.,,,,,,,,,,,,,,,,,,,,,,,,,,,,,,,,,,,,,,,,,,,,,,,,,,,,,,,,
86,"В Viber появилась функция, которая должна защитить белорусов от звонков мошенников.

Наконец-то!… https://t.co/9pPLyLjGkS",@tutby Очень хорошо. Советую пожилым родственникам эту опцию подключить в первую очередь!,"@tutby ну,наверное,не только белорусов?","@tutby посмеялся. т.е. паспортные і банковскіе  данные, продаренные лукашенкой путіну, не прічем.",,,,,,,,,,,,,,,,,,,,,,,,,,,,,,,,,,,,,,,,,,,,,,,,,,,,,,
87,"Путин заявил о способности интернета разрушить общество изнутри.

https://t.co/rpbP74Zrlp https://t.co/lrSroVjtjF",@tutby Ни..уясе аж 1917 года изнутри разрушает 🤣,@tutby За интернет и бабульки выйдут на улицу! Не рискуй путин,"@tutby Ого, как в комментарии слетаются рагули. Просто как мухи на дерьмо! 😁","@tutby Если он всеобщий и не отвечает цензуре определённого режима, безусловно, это угроза.",@tutby Вот же диктаторов интернет бесит...,@tutby Just like Das Kapital did in the past!,@tutby Ого. Эффективней чем дешевая алкашка в магазинах?,"@tutby Разрушать интернет может только лапшу, которую всякие плешивые дегенераты пытаются вешать всему обществу на уши.",@tutby Рыхтуемся да блакіроўкі,"@tutby Фигассе заява от президента! Это что же он за общество такое построил, воспитанное ""на великих победах дИдов… https://t.co/5vP4CrjJvb","@tutby Yeah, by informing people how corrupted their government is.",@tutby Мудрые китайцы это сразу поняли и теперь это самая развитая страна в мире...,@tutby Открыл Америку...,"@tutby Вы издеваетесь, нам своего говна мало что ли","@tutby Maybe he is correct?
Twitter, YouTube and Facebook needs to BAN all Kremlin and Kremlin sponsored accounts.","@tutby Интернет разрушает не общество, а ложь в обществе. С приходом интернета, пердункам вроде путена, стало невоз… https://t.co/cp4gcTSlYz","@tutby бункерная пыня с диалапа в чебурнете зависает, оттого совсем мозги отгнили, если когда там что-то вообще было","@tutby Время людей помнящих СССР стремительно уходит, как песок сквозь пальцы.",@tutby https://t.co/4J2Cy2litB,"@tutby Ну пусть при помощи интернета разрушит общество в: Германии, Франции, США, Японии и т.д. Что, не очень то по… https://t.co/iPszAK9pSd",@tutby Важное заявление Путина на счёт интернета https://t.co/nabG4QyzCR,@tutby Поверьте...он больше всех интересуется интернетом. Это просто позиция для терпил  - мол я такой консервативн… https://t.co/98XUJY06PJ,@tutby поэтому его надо отключить ....,"@tutby слухи подтверждаются, путлер хочет  ввести железный занавес и китайский файрволл",@tutby Надо начинать с себя ИМХО,"@tutby Тутбай, Вы НЕ согласны?????? Вы же этим занимаетесь ежедневно в РБ!",@tutby Больной на голову,@tutby Ещё один представитель кнопочных,"@tutby Общество в кавычки.
Или замените на быдлостадо.",@tutby Путін Хуйло,@tutby путин - хуйло!,"@tutby Правильно,каждому в квартиру по мутному зеркалу,пусть 'старший брат'смотрит на нас.","@tutby Смена транспорта с лошадей на автомобили - тоже самое, это просто часть прогресса",@tutby https://t.co/H8pGaJOAmf,,,,,,,,,,,,,,,,,,,,,,,
88,"Что происходит, когда человек заражается сразу двумя штаммами COVID-19?

https://t.co/QPKbkGXr4t https://t.co/QMZPpAxpI8",@tutby Ни..уясе аж 1917 года изнутри разрушает 🤣,@tutby За интернет и бабульки выйдут на улицу! Не рискуй путин,"@tutby Ого, как в комментарии слетаются рагули. Просто как мухи на дерьмо! 😁","@tutby Если он всеобщий и не отвечает цензуре определённого режима, безусловно, это угроза.",@tutby Вот же диктаторов интернет бесит...,@tutby Just like Das Kapital did in the past!,@tutby Ого. Эффективней чем дешевая алкашка в магазинах?,"@tutby Разрушать интернет может только лапшу, которую всякие плешивые дегенераты пытаются вешать всему обществу на уши.",@tutby Рыхтуемся да блакіроўкі,"@tutby Фигассе заява от президента! Это что же он за общество такое построил, воспитанное ""на великих победах дИдов… https://t.co/5vP4CrjJvb","@tutby Yeah, by informing people how corrupted their government is.",@tutby Мудрые китайцы это сразу поняли и теперь это самая развитая страна в мире...,@tutby Открыл Америку...,"@tutby Вы издеваетесь, нам своего говна мало что ли","@tutby Maybe he is correct?
Twitter, YouTube and Facebook needs to BAN all Kremlin and Kremlin sponsored accounts.","@tutby Интернет разрушает не общество, а ложь в обществе. С приходом интернета, пердункам вроде путена, стало невоз… https://t.co/cp4gcTSlYz","@tutby бункерная пыня с диалапа в чебурнете зависает, оттого совсем мозги отгнили, если когда там что-то вообще было","@tutby Время людей помнящих СССР стремительно уходит, как песок сквозь пальцы.",@tutby https://t.co/4J2Cy2litB,"@tutby Ну пусть при помощи интернета разрушит общество в: Германии, Франции, США, Японии и т.д. Что, не очень то по… https://t.co/iPszAK9pSd",@tutby Важное заявление Путина на счёт интернета https://t.co/nabG4QyzCR,@tutby Поверьте...он больше всех интересуется интернетом. Это просто позиция для терпил  - мол я такой консервативн… https://t.co/98XUJY06PJ,@tutby поэтому его надо отключить ....,"@tutby слухи подтверждаются, путлер хочет  ввести железный занавес и китайский файрволл",@tutby Надо начинать с себя ИМХО,"@tutby Тутбай, Вы НЕ согласны?????? Вы же этим занимаетесь ежедневно в РБ!",@tutby Больной на голову,@tutby Ещё один представитель кнопочных,"@tutby Общество в кавычки.
Или замените на быдлостадо.",@tutby Путін Хуйло,@tutby путин - хуйло!,"@tutby Правильно,каждому в квартиру по мутному зеркалу,пусть 'старший брат'смотрит на нас.","@tutby Смена транспорта с лошадей на автомобили - тоже самое, это просто часть прогресса",@tutby https://t.co/H8pGaJOAmf,,,,,,,,,,,,,,,,,,,,,,,
89,"В Новой Боровой на крыше одного из домов повесили большой красно-зеленый флаг.

Местные жители пишут, что для этого… https://t.co/4d55uiAcjF",@tutby Красота!,"@tutby It is only a rag from which blood drips.
It will not be the rag of the future.
Let's see how long the rag of the blood regime hangs",@tutby #Яматки в трауре,"@tutby терпите, беларусы",@tutby Ну теперь то уж точно все воспылают любовью к лукашизму,@tutby Блять 🤬🤬🤬🤬🤬🤬🤬🤬🤬,@tutby МОЛОДЦЫ!,@tutby 🤣🤣🤣 вскрыли доступ🤣🤣🤣 МЧС доступ вскрыло?,@tutby Супер спасибо,@tutby Ещё ФСБ РФ снайперов на соседних крышах поставили.  Точно говорю.,@tutby красота,"@tutby Што ты не павесь, ну ўсё роўна вас гэтыя людзі ненавідзяць. Тое што вы ваткнулі гэту палку на даху гэта што… https://t.co/v3LkfMC53r",@tutby После провала революции - реакция,@tutby кз-дебилы,"@tutby Парень подкладывает в гульфик носок, девушка вату в бюстгальтер, ябатьки вешают лукафлаг в протестном районе.","@tutby Теперь ждём репортажа Азаренка о подвиге, сравнимом со взятием Рейхстага)","@tutby Вибачте, а в Біларусі дахами менти завідують ?",@tutby отлично! и пусть попробуют снимут... а это уже статья УК..,@tutby 👍👍👍,@tutby О Конституции Беларуси вспомнилось https://t.co/LlzX03MBuV,@tutby Ну так на то эти структуры и созданы. Или нет?,"@tutby То есть что, когда над одном из домов стояло бчб знамя, это не было нарушением противопожарной безопасности,… https://t.co/RkQxr9li4Y",@tutby Красиво!!!!,"@tutby пишите заяву о том, что горючие материалы на крыше",@tutby ЗачЭм? ))),@tutby HELLarus 🇧🇾,"@tutby МЧС вскрыли доступ на крышу....
Как посмели!)))",@tutby Так можно или нельзя флаги на крыше??? Или зелёный цвет не горит? 🙄,"@tutby Блядь, какие же беспросветные долбоёбы...","@tutby Эта флагофрения уже выходит за рамки разумного и неразумного. Этим же кретинам, кто исполняет волю больного… https://t.co/zCRZ6hd0AK","@tutby внучки лагерных вертухаев во всей красе. все награды,  за выстрелы в затылок и пытки безоружных гражданских","@tutby Ну все, терь точно патриотизЬм распространится на весь район! Ну и, как известно, государственный флаг огнеу… https://t.co/l6bBKKPAup","@tutby Они не пытаются заставить полюбить, это просто месть. И делают они это по той же причине, по которой коты ли… https://t.co/235vQV5nRJ","@tutby Это ни Синепальцему, ни его красаўцам не поможет)))
Вот убогие, все как в совке: на все, что способны - это… https://t.co/a7qgUqh3Bo","@tutby Любовь к флагу, так не прививается, такая любовь строится из рабочих законов и качества жизни, а не благодар… https://t.co/8SxzbCFSvO","@tutby Блин они там ненавистью питаются что ли на завтрак, обед и ужин или что...","@tutby Горит, горит змагарский пукан 👍👍👍👍.","@tutby беззаконие при всемерной поддержке @112by. Вам не стыдно, спасатели, такой фигней заниматься? 
ВСКРЫВАТЬ ДОС… https://t.co/pOKTzni12p",@tutby Открытая война и установка флагов на завоёванных зданиях?,@tutby Жыве Белорусь!,"@tutby говорят, что скоро запретят жёлтый сигнал на светофорах","@tutby От, красiва здзелалi. Дауно пара была захвацiць цытадэль",@tutby Ахахаха они рейхстаг перепутали с Новой боровой или это репетиция 🤷‍♀️,@tutby https://t.co/MZoyltZLE5,@tutby Блядзі,"@tutby Прымусам немагчыма заставіць нешта любіць. Кпд акцыі- хутчэй мінусавы, мне здаецца. Выратавальнікі, вам не сорамна?",@tutby Имхо это незаконное проникновение на частную собственность. Установка конструкций не предусмотренных проекто… https://t.co/iydcyORlGX,@tutby Capture the flag mode,"@tutby Недолго эта тряпка там провисит). 
Ну если только лукафашики не обмотают флагшток колючкой, а подступы не заминируют.))",@tutby полегчало?,,,,,,,
90,Известная правозащитная организация — о независимости судебной системы и верховенстве закона в Беларуси. https://t.co/cWjM6O54TT,"@tutby Там должна бать оценка -100, а не 0.",@tutby https://t.co/eyK2gJxrhQ,@tutby https://t.co/rCstOOS29e,@tutby Заслуженно,@tutby https://t.co/Rstf6axYqF,@tutby Вы уточняйте что 100% независимости получают те кто 100% под контрооем США),"@tutby Известна правозашитная, НАТО или Госдеп ?)))",@tutby https://t.co/vtAC5PbPBQ,@tutby https://t.co/3Lf6VtdoSi,@tutby https://t.co/Hj4Qm83hsq,"@tutby Щас Ермошина ""8"" припишет","@tutby ""Только не смейтесь, у нас самый независимый суд в мире""",@tutby ОО - такая оценка вашим потугам,"@tutby Верховенство права есть только в правовых странах, а право проверяется просто. Если то что написано в консти… https://t.co/hvAWB6rjWC","@tutby Ну Freedom House, финансируемый правительством ""самой демократичной страны мира"" периодически стреляющей ""вн… https://t.co/o2Xm7WUcfp","@tutby - Какова оценка независимости судебной системы и верховенства закопана в Беларуси?
- Думаю что овал.",@tutby https://t.co/F9uq2fNgir,"@tutby В Вашiнгтоне, каля нуля))","@tutby невозможно оценить то, чего нет",@tutby обычный репрессивный орган :(,@tutby надеюсь хотя бы худой,@tutby -150000000 дно же непробиваемое,,,,,,,,,,,,,,,,,,,,,,,,,,,,,,,,,,,
91,"Идея — утеплить дом опилками. 

Сколько это стоит, какие есть за и против?

https://t.co/hpitEASv99 https://t.co/xPOIREGlay",@tutby гореть будет классно! если в @112by  еще остались нормальные профессионалы они подтвердят.,"@tutby Пожароопасная идея, лучше утеплять только специальными утеплителями типа каменной ваты.",@tutby а як потім горить https://t.co/CK7qHmRqKC,@tutby в древности люди утепляли дома иголками от елок.,"@tutby завиральная, пустая, фантастически идиотская идея","@tutby Ідэя гаўно. Завядецца жыўнасць- наробіць хадоў- вось вам і свішчы, мостыкі холаду. 
Існуе нармальны варыянт… https://t.co/U1Mge7yk33",@tutby Є поняття - протипожежна безпека!!! Так можна й порохом утеплити!,"@tutby За: экологичность (*нет)
Против: 
1. пожароопасность (если с пропиткой - прощай экологичность)
2. Насекомые… https://t.co/8Qwh9Qb2wV",@tutby И облить бензином,"@tutby Отличная идея, только опилки нужно гасить пушонкой...",@tutby насекомые заведуться сто пудов,,,,,,,,,,,,,,,,,,,,,,,,,,,,,,,,,,,,,,,,,,,,,,
